User Input,Chatbot Response,Timestamp
hai,"Gardening tips include choosing the right plants for your climate, watering properly, and using organic fertilizers.",2024-12-01 18:55:09
hi,Hi there,2024-12-01 18:55:21
how are you,Nothing much,2024-12-01 18:55:36
are you good,I can answer questions and provide assistance,2024-12-01 18:55:51
hai,"Gardening tips include choosing the right plants for your climate, watering properly, and using organic fertilizers.",2024-12-01 19:00:53
what are you?,My purpose is to assist you,2024-12-01 19:01:06
how are you?,Hi there,2024-12-01 19:01:18
what is football?,"Mindfulness techniques include meditation, deep breathing, body scanning, and mindful eating.",2024-12-01 19:01:32
what is education?,"Mindfulness is the practice of being fully present in the moment, observing thoughts and feelings without judgment.",2024-12-01 19:01:43
enterpreneurship,"Gardening tips include choosing the right plants for your climate, watering properly, and using organic fertilizers.",2024-12-01 19:02:10
hai,"Gardening tips include choosing the right plants for your climate, watering properly, and using organic fertilizers.",2024-12-01 19:04:16
what?,I am a chatbot,2024-12-01 19:04:29
hey,"I'm fine, thank you",2024-12-01 19:44:42
hey,Nothing much,2024-12-01 19:56:52
Hey,Hello,2024-12-01 19:57:13
How are you?,Nothing much,2024-12-01 19:57:23
How is your health?,"Mindfulness techniques include meditation, deep breathing, body scanning, and mindful eating.",2024-12-01 19:57:38
who are you?,I am a chatbot,2024-12-01 19:57:50
what is my age,"Mindfulness techniques include meditation, deep breathing, body scanning, and mindful eating.",2024-12-01 19:58:04
what is your age?,I am a chatbot,2024-12-01 19:58:14
what is age?,"Mindfulness techniques include meditation, deep breathing, body scanning, and mindful eating.",2024-12-01 19:58:23
can i know about?,"Gardening tips include choosing the right plants for your climate, watering properly, and using organic fertilizers.",2024-12-01 19:58:38
you are wrong?,I can answer questions and provide assistance,2024-12-01 19:58:52
you are wrong.,I can answer questions and provide assistance,2024-12-01 19:59:00
feel like my asssitance,Growing a vegetable garden allows you to enjoy fresh produce and connect with nature.,2024-12-01 19:59:13
sorting,"I'm fine, thank you",2024-12-01 20:06:30
what is sorting,Sorting is an important operation in data management. Quicksort uses the divide-and-conquer approach to sort data efficiently.,2024-12-01 20:06:42
hi,Hello,2024-12-06 16:19:04
Hi,Hello,2024-12-06 16:19:11
HELLO,Hi there,2024-12-06 16:19:20
Hi,Hey,2024-12-06 16:35:06
Hello,"I'm fine, thank you",2024-12-06 16:35:13
How Are you,Hey,2024-12-06 16:35:24
how,"Mindfulness is the practice of being fully present in the moment, observing thoughts and feelings without judgment.",2024-12-06 16:35:35
sports,Sports are a great way to stay active and entertained. There's a wide range of sports to explore and enjoy!,2024-12-06 16:35:43
mobile,Growing a vegetable garden allows you to enjoy fresh produce and connect with nature.,2024-12-06 16:35:52
games,"Gardening tips include choosing the right plants for your climate, watering properly, and using organic fertilizers.",2024-12-06 16:36:03
hello,Hello! How can I assist you today?,2024-12-06 16:38:40
what should di in morning?,"A productive morning routine might include meditation, journaling, or setting goals for the day.",2024-12-06 16:41:16
what was the day,Hi there! How can I help?,2024-12-06 16:41:25
how was the day?,Hello! How can I assist you today?,2024-12-06 16:41:36
assddadd,Hello! How can I assist you today?,2024-12-06 16:41:43
assddadddad,Hi there! How can I help?,2024-12-06 16:41:46
ass,Hello! How can I assist you today?,2024-12-06 16:41:50
drink?,Hi there! How can I help?,2024-12-06 16:41:55
what should i eat?,"Include a balance of protein, carbs, and healthy fats in your meals. Snack on nuts or fruits when hungry.",2024-12-06 16:42:04
what should i eat in afternoon?,"For breakfast, try oatmeal with fruits or a protein smoothie. Lunch could be grilled chicken with veggies, and dinner a light salad or soup.",2024-12-06 16:42:11
what can i relax?,"Spend time on hobbies you enjoy, like reading, drawing, or gardening.",2024-12-06 16:42:24
hello,Hi there! How can I help?,2024-12-06 16:55:32
hello,Hi there! How can I help?,2024-12-06 16:56:25
How are you?,See you later!,2024-12-06 16:56:52
How are you?,See you later!,2024-12-06 16:56:57
programming?,"Programming languages are used to write software. Popular languages include Python, JavaScript, Java, C++, Ruby, and Go.",2024-12-06 16:57:06
football?,Football is played on a rectangular field with goals at each end. It's the most popular sport in the world.,2024-12-06 16:57:24
what should I do today?,"A productive morning routine might include meditation, journaling, or setting goals for the day.",2024-12-06 16:57:50
what should I do now?,"Start your morning with a glass of water to hydrate. Then, try some light stretching or a short workout, followed by a healthy breakfast.",2024-12-06 16:57:59
what is my schedule on morning?,Hi there! How can I help?,2024-12-06 16:58:14
what should I do in the  morning?,"Begin your day by making your bed, getting fresh air, and preparing a nutritious meal.",2024-12-06 16:58:34
history?,"Some key historical periods include the Renaissance, the Industrial Revolution, and the Cold War. Each marked significant changes in culture, technology, and society.",2024-12-06 16:58:58
history,World War II happened from 1939 to 1945 and involved most of the world’s nations. It was a major conflict between the Allies and the Axis powers.,2024-12-06 16:59:01
tell me about albert einstein?,"William Shakespeare was an English playwright, poet, and actor, widely regarded as one of the greatest writers in the English language.",2024-12-06 16:59:13
tell me about famous person?,"William Shakespeare was an English playwright, poet, and actor, widely regarded as one of the greatest writers in the English language.",2024-12-06 16:59:28
tell me about william shakespeare?,"The President of the United States is Joe Biden, elected as the 46th president in 2020.",2024-12-06 16:59:39
who is man?,"William Shakespeare was an English playwright, poet, and actor, widely regarded as one of the greatest writers in the English language.",2024-12-06 16:59:51
what should i eat now?,"Meal prep can save time. Prepare simple dishes like rice bowls, wraps, or pasta with vegetables.",2024-12-06 17:00:11
what should i eat now?,"Include a balance of protein, carbs, and healthy fats in your meals. Snack on nuts or fruits when hungry.",2024-12-06 17:00:19
ok then bye,See you later!,2024-12-06 17:00:39
